{
  "kind": "sdlc-log",
  "schema_version": "1",
  "feature": "checkout-retry",
  "feature_dir": "specs/014-checkout-retry/",
  "run_started": "2026-09-20",
  "mode": "agent-sdlc",
  "status": "complete",
  "gates": [
    {
      "gate": "A",
      "name": "design",
      "cycle": 1,
      "corpus": [
        "specs/014-checkout-retry/spec.md"
      ],
      "rsvp": [
        {
          "persona": "alan-cooper-advisor",
          "lens": "adversarial product",
          "decision": "JOIN",
          "applies": [
            "retry changes what the shopper sees on failure"
          ],
          "expected": "🟡",
          "hook": "silent retries",
          "reason": "User-visible failure path.",
          "seated": true,
          "seat": "ordinary"
        },
        {
          "persona": "mark-richards-architect",
          "lens": "architecture",
          "decision": "JOIN",
          "applies": [
            "new retry coordinator"
          ],
          "expected": "🟡",
          "hook": "new component",
          "reason": "New component.",
          "seated": true,
          "seat": "ordinary"
        },
        {
          "persona": "eliyahu-goldratt-advisor",
          "lens": "constraint and flow",
          "decision": "JOIN",
          "applies": [
            "the cut: retries across payment providers"
          ],
          "expected": "🟡",
          "hook": "scope",
          "reason": "The cut.",
          "seated": true,
          "seat": "ordinary"
        },
        {
          "persona": "eric-evans-advisor",
          "lens": "DDD",
          "decision": "ABSTAIN",
          "reason": "No domain model change at design.",
          "seated": false
        }
      ],
      "seating": {
        "band": "🟢"
      },
      "quorum": "ok",
      "premise_pass": {
        "red_team": [
          {
            "item": "RT-1",
            "outcome": "Observed: 3% of checkouts fail on a transient provider error (payments dashboard)."
          },
          {
            "item": "RT-2",
            "outcome": "Root cause is provider flakiness; retry treats it at the right layer."
          },
          {
            "item": "RT-3",
            "outcome": "No: the need predates the feature."
          },
          {
            "item": "RT-4",
            "outcome": "A one-week manual retry button would measure recovery; judged costlier than the feature."
          },
          {
            "item": "RT-5",
            "outcome": "Shoppers who abandon after a failure; evidenced by the abandonment metric."
          },
          {
            "item": "RT-6",
            "outcome": "Falsified if retried checkouts do not complete more often than today."
          }
        ],
        "honest_null": {
          "premise_survives": true,
          "tried": [
            {
              "persona": "eliyahu-goldratt-advisor",
              "attack_form": "steelman-null",
              "note": "Doing nothing loses the 3% of checkouts that fail transiently; the null is weaker than the feature."
            }
          ]
        },
        "pass_ok": true
      },
      "register": [
        {
          "id": "F1",
          "author": "eliyahu-goldratt-advisor",
          "lens": "constraint and flow",
          "authored_severity": "🟡",
          "locator": "specs/014-checkout-retry/spec.md:40",
          "pull_quote": "Cross-provider retry is inventory until one provider's retry is measured.",
          "evidence": [
            {
              "kind": "file_line",
              "ref": "specs/014-checkout-retry/spec.md:40"
            }
          ],
          "confidence_on_hand": "high",
          "need_info": false,
          "graded": true,
          "scope": "premise"
        },
        {
          "id": "F2",
          "author": "alan-cooper-advisor",
          "lens": "adversarial product",
          "authored_severity": "🟢",
          "locator": "specs/014-checkout-retry/spec.md:55",
          "pull_quote": "The shopper is never told a retry is happening.",
          "evidence": [
            {
              "kind": "file_line",
              "ref": "specs/014-checkout-retry/spec.md:55"
            }
          ],
          "confidence_on_hand": "high",
          "need_info": false,
          "graded": true,
          "scope": "within-frame"
        }
      ],
      "tally": [
        {
          "finding": "F1",
          "authored_severity": "🟡",
          "status": "graded",
          "n": 2,
          "p": 0,
          "c": 2,
          "o": 0,
          "net": 0,
          "threshold": 1,
          "movement": "agreed",
          "final_severity": "🟡",
          "convergence": 2,
          "gating": false
        },
        {
          "finding": "F2",
          "authored_severity": "🟢",
          "status": "unvoted",
          "n": 0,
          "p": 0,
          "c": 0,
          "o": 0,
          "net": 0,
          "threshold": 1,
          "movement": "unvoted",
          "final_severity": "🟢",
          "convergence": 0,
          "gating": false
        }
      ],
      "red_resolutions": [],
      "outcome": {
        "result": "pass",
        "next": "speckit-plan"
      }
    },
    {
      "gate": "B",
      "name": "plan-tasks",
      "cycle": 1,
      "corpus": [
        "specs/014-checkout-retry/plan.md",
        "specs/014-checkout-retry/tasks.md"
      ],
      "rsvp": [
        {
          "persona": "mark-richards-architect",
          "lens": "architecture",
          "decision": "JOIN",
          "applies": [
            "retry coordinator placement in plan.md"
          ],
          "expected": "🟡",
          "hook": "placement",
          "reason": "Placement.",
          "seated": true,
          "seat": "ordinary"
        },
        {
          "persona": "eric-evans-advisor",
          "lens": "DDD",
          "decision": "JOIN",
          "applies": [
            "payment attempt entity added"
          ],
          "expected": "🟡",
          "hook": "new entity",
          "reason": "New entity.",
          "seated": true,
          "seat": "ordinary"
        },
        {
          "persona": "security-and-trust-advisor",
          "lens": "security",
          "decision": "JOIN",
          "applies": [
            "card tokens reused across retries"
          ],
          "expected": "🔴",
          "hook": "token reuse",
          "reason": "Token reuse.",
          "seated": true,
          "seat": "ordinary"
        }
      ],
      "seating": {
        "band": "🟢"
      },
      "quorum": "ok",
      "register": [
        {
          "id": "F1",
          "author": "security-and-trust-advisor",
          "lens": "security",
          "authored_severity": "🟡",
          "locator": "specs/014-checkout-retry/plan.md:72",
          "pull_quote": "A retried charge reuses a card token past its single-use window.",
          "evidence": [
            {
              "kind": "file_line",
              "ref": "specs/014-checkout-retry/plan.md:72"
            }
          ],
          "confidence_on_hand": "high",
          "need_info": false,
          "graded": true
        }
      ],
      "tally": [
        {
          "finding": "F1",
          "authored_severity": "🟡",
          "status": "graded",
          "n": 2,
          "p": 2,
          "c": 0,
          "o": 0,
          "net": 2,
          "threshold": 1,
          "movement": "escalate",
          "final_severity": "🔴",
          "convergence": 2,
          "gating": true
        }
      ],
      "red_resolutions": [
        {
          "finding": "F1",
          "disposition": "resolved",
          "detail": "Incorporated via speckit-clarify → plan → tasks: a fresh token per attempt; verified by the cycle-2 re-run."
        }
      ],
      "outcome": {
        "result": "self-heal"
      }
    },
    {
      "gate": "B",
      "name": "plan-tasks",
      "cycle": 2,
      "corpus": [
        "specs/014-checkout-retry/plan.md",
        "specs/014-checkout-retry/tasks.md"
      ],
      "rsvp": [
        {
          "persona": "mark-richards-architect",
          "lens": "architecture",
          "decision": "JOIN",
          "applies": [
            "revised token handling in plan.md"
          ],
          "expected": "🟢",
          "hook": "re-check",
          "reason": "Re-check.",
          "seated": true,
          "seat": "ordinary"
        },
        {
          "persona": "eric-evans-advisor",
          "lens": "DDD",
          "decision": "JOIN",
          "applies": [
            "payment attempt entity revised"
          ],
          "expected": "🟢",
          "hook": "re-check",
          "reason": "Re-check.",
          "seated": true,
          "seat": "ordinary"
        },
        {
          "persona": "security-and-trust-advisor",
          "lens": "security",
          "decision": "JOIN",
          "applies": [
            "fresh token per attempt"
          ],
          "expected": "🟡",
          "hook": "verify fix",
          "reason": "Verify the fix.",
          "seated": true,
          "seat": "ordinary"
        }
      ],
      "seating": {
        "band": "🟢"
      },
      "quorum": "ok",
      "register": [
        {
          "id": "F1",
          "author": "security-and-trust-advisor",
          "lens": "security",
          "authored_severity": "🟢",
          "locator": "specs/014-checkout-retry/plan.md:72",
          "pull_quote": "Tokens are now minted per attempt; only the audit log wording remains.",
          "evidence": [
            {
              "kind": "file_line",
              "ref": "specs/014-checkout-retry/plan.md:72"
            }
          ],
          "confidence_on_hand": "high",
          "need_info": false,
          "graded": true
        }
      ],
      "tally": [
        {
          "finding": "F1",
          "authored_severity": "🟢",
          "status": "graded",
          "n": 2,
          "p": 0,
          "c": 2,
          "o": 0,